,ngo_name,full_address,city,state,contact_1,contact_2,website,mail
0,1008 BHAGWAN SHRI MAHAVEER JAIN MINORITY CHARITABLE TRUST (R),ALAMATTI ROAD MUDDEBIHAL-586212,MUDDEBIHAL,KARNATAKA,Not Available,9972451202,Not Available,mbscollege1008(at)gmail[dot]com
0,A G N FOUNDATION,NO 1445 VAJRAS NO 6 SOUTH END A CROSS 28TH MAIN JAYANAGAR 9TH BLOCK,BANGALORE,KARNATAKA,Not Available,7989675617,Not Available,agnfoundation333(at)gmail[dot]com
0,A H Memorial Educational trust,"CA Site 7P 1A, PRESIDENCY SCHOOL, 2nd A Main, 3rd A, cross, East of N.G.E.F Layout, Kasturinagar, Bengaluru, Karnataka 560043",BANGALORE,KARNATAKA,080-46699333,9886700012,http://www.presidencyuniversity.in,nissar(at)presidency[dot]edu.in
0,A Hundred Hands,4 Ashley Road Off MG Road Bangalore 560025,bangalore,KARNATAKA,Not Available,9845008482,http://www.ahundredhands.com,a100hands(at)gmail[dot]com
0,A ONE EDUCATIONAL WELFARE TRUST,"No: 117, 6th Main Road, 6th Cross, Near Quba Masjid, Yarab Nagar, Banashankari, Bangalore560070",BANGALORE,KARNATAKA,Not Available,9632637803,Not Available,nnaziyara(at)gmail[dot]com
0,A Plus Institute,"Plot no. 104 ,105 Inderdas complex 2nd floor super market Gulbarga. 585101",Gulbarga,KARNATAKA,Not Available,7676922020,Not Available,arvindhiremath88[dot]ah(at)gmail.com
0,A Shama Rao Foundation,"13-02-116 HOTEL SRINIVAS BUILDING G.H.S. ROAD, MANGALORE",Mangalore,KARNATAKA,Not Available,9343348392,Not Available,psaithal(at)gmail[dot]com
0,A V P SEVA SANSTHE,"Aparna Building, 1st floor, Uppartkeri 1st Cross, Near New KSRTC Bus Stand, Kumta581343",KUMTA,KARNATAKA,Not Available,9449655191,Not Available,avpkumtacpf(at)gmail[dot]com
0,A Z SILK INDUSTRIAL ASSOCIATION,JAMALSABPALYA villege.KEMPASANDRA post. MAGADI taluq. RAMANAGARA dist.562120,magadi,KARNATAKA,Not Available,9448860084,Not Available,azsilkindustrial18(at)gmail[dot]com
0,AABHARI TRUST,"No.61, Bhavani Nagar, DB Kallu Channanayakana Palya, Nagasandra Post Bengaluru560073",Bengaluru,KARNATAKA,Not Available,9986782712,Not Available,subramanya73(at)gmail[dot]com
0,AADHAR EDUCATION AND RURAL DEVELOPMENT SOCIETY,H NO 5-9-81/1(19) BEHIND APMC YARDBHALKI DIST BIDAR,BHALKI,KARNATAKA,Not Available,7892695893,Not Available,aadharerds(at)gmail[dot]com
0,Aadhar Foundation Bedkihal,"TMC Plot no.2512/1118, Gandhi Market Shetty Galli , Chikodi -591201",Chikodi,KARNATAKA,Not Available,7349763297,http://drugrehabcentre.co.in/,chikodiaadharcentre(at)gmail[dot]com
0,AADISHAKTHI SOCIAL DEVELOPMENT MAHILA MANDAL,R/O. MIG- 2-5 KHB COLONY BHALKI TQ. BHALKI DIST. BIDAR585328,BHALKI,KARNATAKA,Not Available,9972901535,Not Available,rathodasha641(at)gmail[dot]com
0,aafoundation for community development,186 4 I a main 3rd a cross gururajalayout doddanekkundi bengaluru 560037,bengaluru,KARNATAKA,080-41266374,9343851618,http://aafoundation.in,aafoundation2012(at)yahoo[dot]com
0,AAHWAHAN FOUNDATION,"No.40, South End Main Road, Jayanagar 9th Block, Bangalore-560069",BANGALORE,KARNATAKA,Not Available,9113018004,Not Available,info(at)aahwahan[dot]com
0,AALA HAZRAT EDUCATIONAL AND CHARITABLE TRUST,"H. No- 3-3-35, Noor Khan Taleem, Dist.- Bidar- 585401,Karnataka.",Bidar,KARNATAKA,Not Available,8050427824,Not Available,ahectbdr0809(at)gmail[dot]com
0,AAPATHABANDHAVA,"1451A, NAIKAR ONI, HEBBALLI",HEBBALLI,KARNATAKA,Not Available,9972024653,Not Available,aapathbandhavango(at)gmail[dot]com
0,Aapyam Ayurveda Foundation,"Pragathinagar, Jog Road, NH 206, Sagar-577401,Shimoga, Karnataka",SAGARA,KARNATAKA,Not Available,9980375322,http://aapyamayurveda.com,aapyamayurvedafoundation(at)gmail[dot]com
0,AARAV INSTITUTE FOR MANAGEMENT SERVICES PRIVATE LIMITED,"22, 8th Main, 3rd Cross, Saraswathipuram, Mysore570009",Mysore,KARNATAKA,Not Available,8105463226,http://www.aimsconsultants.in,chays[dot]hn(at)gmail.com
0,AAROCARE,"Old No.2, New No.109/1 10th Main, Opp. Madhavan ParkJayanagar 3rd Block, Bangalore",BANGALORE,KARNATAKA,Not Available,9945106676,http://aarocare.org,drpramods(at)gmail[dot]com
0,AARTHI VIKAS MAHILA SAMITHI,"PLOT NO 24, SACHIN NILAYA , BEHIND KARNATAKA COLLEGE ,CHANNABASAVA NAGAR , BIDAR KARNATAKA -585401",BIDAR,KARNATAKA,Not Available,9663938281,Not Available,kaveriswamy(at)gmail[dot]com
0,AARUSH GRAMEENA And RURAL SOCIETY,AARUSH GRMEENA,KALABURGI,KARNATAKA,Not Available,9986295066,Not Available,rameshshikari85(at)gmail[dot]com
0,AASHIANAA ANINSTITUTE FOR SPECIAL CHILDREN,520 MAHADEVAPURA EXTENSION UDAYAGIRI MYSORE,MYSORE,KARNATAKA,Not Available,9448271109,Not Available,aashianaa6(at)gmail[dot]com
0,AASHNA FOUNDATION,AASHNA FOUNDATION 134 BHANDIWAD BASE PHATTER PHOD STREET,HUBLI,KARNATAKA,0836-4250474,9449127897,http://www.aashnafoundation.org,aashna_hubli(at)yahoo[dot]in
0,Aashrita Charitable Trust,Aashrita Charitable Trust(R) Anakanur Gate DC Office(Siddlagatta ) Road Chikkaballapur Pin 562101,Chikkaballapur,KARNATAKA,080-49555855,9900093399,Not Available,aashritacbpur(at)gmail[dot]com
0,Aashwasan Foundation,No.50Usyayana 2nd Cross Kasturi Nagar Bangalore560043,Bangalore,KARNATAKA,Not Available,8861186730,Not Available,vindyab(at)aashwasan[dot]com
0,Aatmalaya Academy of Art and Culture Trust,"98/6, Krishnageet Aparments, 2nd Main, Seshadripuram",Bangalore,KARNATAKA,080-23343393,919448068,http://www.drpadmaja.net,aatmalaya2002(at)gmail[dot]com
0,aavi rural and urban development organisation,"Aavi rural and urban development organization (ARUDO) Kodur Post, 577 418 Hosanagar -Taluk Shimoga - Dist Karnataka -State Mobile :91 9731554955 E-mail : aavingo@gmail.com",Hosanagar,KARNATAKA,08185-267050,9731554955,http://www.arudo.org,aavingo(at)gmail[dot]com
0,AAYAAMA,"D.no. 982, 21st main road, 2nd block, mariyappanapalya, jnanabharathi layout, Nagadevanahalli, karnataka, bangalore-560056",Banglore,KARNATAKA,080-225619,7411923864,Not Available,aayaama6(at)gmail[dot]com
0,ABAI,No 584 Second Floor 1A Main 6 Cross HSR Layout,Bangalore,KARNATAKA,Not Available,9900650139,Not Available,abai[dot]deputysecretary(at)gmail.com
0,ABALASHRAMA,"125-6, Dr. D V G Road, Basavanagudi",Bengaluru,KARNATAKA,Not Available,9483334329,Not Available,abalashrama(at)yahoo[dot]com
0,ABHAYA DHAMA HIV SONKITHARA BEMBALA SANGHA,"RENUKAKRUPA NILAYA, NEAR OLD SEETHARAMA KALYANA MANDIRA, 1ST CROSS, DURGIGUDI, SHIVAMOGGA",SHIVAMOGGA,KARNATAKA,Not Available,9901122625,Not Available,shimoganetwork(at)gmail[dot]com
0,ABHAYA FOUNDATION,"DOOR NO 51, VIJAYNAGAR 3RD STAGE HASSAN",HASSAN,KARNATAKA,Not Available,9513299699,http://www.abhayafoundation.com,abhayafoundation19(at)gmail[dot]com
0,ABHAYA INSTITUTE FOR AGRICULTURE And RURAL DEVELOPMENT.,"OLD R T O OFFICE,2ND CROSS, NEAR TO GOVT JUNIOR COLLEGE. VINOBHA NAGAR, SAGAR. SHIVAMOGGADIST,KARNATAKASTATE. PIN577401.",SAGAR,KARNATAKA,Not Available,9980410603,http://www.abhayadevelopment.org,krishnakvlic72(at)gmail[dot]com
0,ABHAYA KALPA FOUNDATION TRUST,69 10TH MAIN 2ND STG MARENAHALLI BINNY LAYOUT VIJAYANAGAR BENGALURU,BENGALURU,KARNATAKA,Not Available,9845006500,https://www.akftrust.org/,contact(at)akftrust[dot]org
0,ABHAYA KALPA FOUNDATION TRUST,69 10TH MAIN 2ND STG MARENAHALLI BINNY LAYOUT VIJAYANAGAR BENGALURU,BENGALURU,KARNATAKA,Not Available,8277396751,http://www.akftrust.org,contact(at)akftrust[dot]org
0,Abhigyan Imperative Movements (AIM),"No 31, Anjanadri Nilaya, Pipeline Road, T Dasarahalli ,",Bangalore,KARNATAKA,Not Available,8884314848,Not Available,kannansiva390(at)gmail[dot]com
0,ABHINANDAN EDUCATION AND RURAL DEVELOPMENT SOCIETY MASKI,"ABHINANDAN EDUCATION AND RURAL DEVELOPMENT SOCIETY MASKI-584124,RAICHUR",RAICHUR,KARNATAKA,Not Available,7795892012,Not Available,hrg[dot]maski(at)gmail.com
0,ABHINAVA ARTS CENTRE,"62, JAIN TEMPLE STREET VISVESWARAPURAM",Bengaluru,KARNATAKA,Not Available,9449316765,http://www.abhinava.dance,nirupamarajendra(at)gmail[dot]com
0,ABHINAYA BHARATHI,Dharini,Bangalore,KARNATAKA,Not Available,9448092904,Not Available,abhinayabharathitrust(at)gmail[dot]com
0,Abhinaya Ranga Kendra,"ABHINAYA RANGA KENDRA KARANATKANo:519, 12th A cross, vigneshwaranagar, Vishwaneedam Post, Sunkadakatte, Bangalore-560 091. Karnataka.",BENGALURU URBAN,KARNATAKA,mysql_prep(080-23289553),9880857321,Not Available,ashwastage(at)gmail[dot]com
0,ABHINYA ARTS CULTURAL CENTRE,"GANDHI BAZAAR, KOPPAL POST",KOPPAL,KARNATAKA,Not Available,9380155274,Not Available,abhinayaculture1980(at)gmail[dot]com
0,Abhishek Charitable Trust,"Abhishek Nethradhama, mosque complex, opposite Rajkamal theatre, Fort road, Dodballapur-561203 Bangalore rural district,",Bangalore,KARNATAKA,Not Available,9844179963,Not Available,ACT4public(at)gmail[dot]com
0,Abhivruddi Society for Social Development,"ABHYUDHAYA 2nd Cross, near TUDA Layout, Manjunathanagara, Kyathasandra Post, Tumkur-572104",Tumakuru,KARNATAKA,0816-2280404,9448370387,http://abhivruddi.com,abhivrudditumkur(at)gmail[dot]com
0,Abhiyan Foundation,"Near Laxmi Temle ,Badiger oni Hukkeri,Karnataka-591309",Hukkeri,KARNATAKA,Not Available,9739968754,http://abhiyanfoundation.org/,abhiyanbgm(at)gmail[dot]com
0,ABHYUDAYA KENDRA,GRATIA PLENA CONVENT SANTIBASTWAD,BELGAUM,KARNATAKA,Not Available,8861087421,Not Available,laveenagrace(at)yahoo[dot]com
0,ABHYUDHAYA SEVA PRATHISTANA,"Paipalya Village, Julapalya post, Bagepalli Taluk, Chikkaballapura Dist. 563159",Bagepalli,KARNATAKA,Not Available,9448845126,Not Available,venkateshpspaipalya(at)gmail[dot]com
0,ABUNDANT LIFE FOR ALL MINISTRIES,NO.83 I MAIN 24TH CROSS MARUTHI NAGAR YELAHANKA BANGALORE-64,BANGALORE,KARNATAKA,Not Available,9845531372,Not Available,Kgollapalli(at)gmail[dot]com
0,ACADEMY FOR CREATIVE TEACHING TRUST,"480, 6th Main, HMT Colony, Opp Bus Depot, R T Nagar",Banglore,KARNATAKA,Not Available,9845206228,http://acttrust.org/,sunita[dot]phadnis(at)actedu.in
0,Academy for Severe Handicaps and Autism( ASHA) Charitable Trust,"L-76/A, Kirloskar Colony, 5th Main, 3rd cross, Basaveshwaranagar, 4th Block",Bangalore,KARNATAKA,Not Available,9901724485,http://www.ashaforautism.com,info(at)ashaforautism[dot]com
0,ACADEMY OF COMPARATIVE PHILOSOPHY AND RELIGION,GURUDEV RANADE MANDIR HINDWADI BELGAUM,BELGAUM,KARNATAKA,Not Available,9448850016,Not Available,info(at)acprbgm[dot]org
0,Accelerate India Foundation Trust,"92, 2nd Main, 2nd Cross, CIL Layout, Sanjaynagar, Bangalore560094",Bangalore,KARNATAKA,Not Available,7411490714,https://www.accelindiatrust.com,apabharana(at)factumindia[dot]law
0,ACCEPT SOCIETY,"245, KRC Road, Dodda Gubbi Post, Bangalore560077",Bangalore,KARNATAKA,Not Available,9448619619,http://www.acceptindia.org/,rajujoyce(at)gmail[dot]com
0,ACCESS,"10, ACCESS, New Chellekere Extension, Kalyan Nagar, Bangalore -560 043",Bangalore,KARNATAKA,Not Available,9448277064,Not Available,accesscares(at)yahoo[dot]co.in
0,ACCION TECHNICAL ADVISORS INDIA,"9/3, Kaiser-E-Hind, 1st Floor and 3rd Floor, Richmond Road, Bangalore, Karnata-560025",BANGALORE,KARNATAKA,Not Available,9958173610,https://www.accion.org/,aagrawal(at)accion[dot]org
0,ACCPL Training Division A unit of Adityaa Call center Pvt Limited,"ACCPL Training Division ( A unit of Adityaa Call Center Private Limited ) No. 88/1 , Shubh Arcade , 16th Cross Margosa Road , Malleswaram , Bangalore 560003",Bangalore,KARNATAKA,080-23468357,9342201736,http://accpltraining.net,accpltrg(at)gmail[dot]com
0,ACE CHARITABLE TRUST,"No29/10A, 14th B Cross,Sarakki Layout, 1st Phase, J P Nagar, Bangalore560078",Bangalore,KARNATAKA,Not Available,9886061182,Not Available,acecharitabletrust(at)gmail[dot]com
0,ACE EDUCATION TRUST,"No.6/1 Cauvery Arcade, Vishwamanava Double Road,Saraswathipuram",Mysore,KARNATAKA,Not Available,9945078459,http://www.aceedutrust.org,rajudeshani(at)hotmail[dot]com
0,Achalabharathi,"190, Nandana 1st Cross, Garden Villas, Nagarabhavi Road, Bengaluru-560072",Bengaluru,KARNATAKA,Not Available,9886408249,http://www.achalabharathi.org,mitra[dot]ar(at)achalabharathi.org
0,ACRESAT,"NO.202, THITTAMARANAHALLI, CHANNAPATNA TALUK, RAMANAGARA DISTRICT",CHANNAPATNA,KARNATAKA,Not Available,9113658686,Not Available,acresat2012(at)gmail[dot]com
0,Action Aid,"139, RICHMOND ROAD",Bangalore,KARNATAKA,Not Available,9818421492,https://www.actionaidindia.org/,amit[dot]dubey(at)actionaid.org
0,Action for Community Organisation Rehabilitation and Development,"14/1, North Road, St.Thomas Town, Bangalore",Bangalore,KARNATAKA,Not Available,8086790638,Not Available,accordgudalur(at)gmail[dot]com
0,Action for Social and Educational Development Association,"Action for social and educational and development assoication , shiva nilaya fortGowribidanur -561208 Gowribidanur (Taluk) Chikkaballpura -District",Gowribidanur,KARNATAKA,08155-286927,9448260531,Not Available,aseda_action(at)yahoo[dot]com
0,ACTION FOUNDATION FOR SOCIAL SERVICES,"37/5, ULSOOR ROAD,YELLAPA CHETTY LAYOUT BANGALORE",Bangalore,KARNATAKA,Not Available,9902907783,Not Available,seeplamesh(at)gmail[dot]com
0,Action Initiative for Development AID,"Gowripura. Kyasenahalli post,Jagalur Taluk, Davanagere district, Pincode: 577528 Karnataka state, India. aidorg@yahoo.in91 9035247600.",Jagalur,KARNATAKA,08192-235684,9035247600,http://www.aid-india.org,aidorg(at)yahoo[dot]in
0,Action on Disability and Development India,"No 4005, 19th Cross, Banashankari 2nd Stage, Bangalore -560070",Bangalore,KARNATAKA,080-26765881,9845963041,Not Available,addindia(at)vsnl[dot]net
0,ACTION SOCIETY FOR INTEGRAL DEVELOPMENT,"ACTION SOCIETY FOR INTEGRAL DEVELOPMENT KUMBARPET, BAGEPALLI - 561 207 CHICKABALLAPUR DISTRICT KARNATAKA",KOLAR,KARNATAKA,08150-282246,9448209169,Not Available,asid_org(at)yahoo[dot]com
0,ACTIONAID KARNATAK PROJEC,"ACTIONAID KARNATAKA PROJECTS 139, RICHMOND ROAD, BANGALORE560025 (KARNATAKA)",BANGALORE,KARNATAKA,Not Available,9448112153,Not Available,tk_ramesh(at)yahoo[dot]com
0,ACTS GROUP OF INSTITUTIONS,"54 KHB COLONY, 5TH BLOCK 2ND CROSS, KORAMANGALA",Bangalore,KARNATAKA,Not Available,9900519128,http://www.acrsgroup.org,cfo(at)actsgroup[dot]org
0,ACTS OF HOPE,"Acts of Hope Lovedale Layout, Kasavanagalli, Carmelaram Post, Bangalore560 035",Bangalore,KARNATAKA,Not Available,9341158445,Not Available,actsofhope[dot]blr(at)gmail.com
0,Adamya Rangasamskruti Trust,"No.89, Ramajyothinagar, Dubasipalya Road, R V Engineering College Post, Mysore Road, Bangalore",Bangalore,KARNATAKA,Not Available,9611124454,Not Available,chayabhargavitheatre(at)gmail[dot]com
0,Adarane Trust,"No. 732, 2ndCross, RK Hegde Nagar, SRK Nagar PO",Bangalore,KARNATAKA,Not Available,9916744744,Not Available,adaranetrust(at)gmail[dot]com
0,Adarsh Education and Social Welfare Scty,"Plot no 2688, M M Extension Belagavi",Belgaum,KARNATAKA,0831-2453018,9900552336,Not Available,aesws[dot]belgaum(at)gmail.com
0,ADARSH FOUNDATION,"DR. A. P. J.ABDUL KALAM BHAVAN , PLOT NO:- 30/07 , SR NO 247/B NEARNEW BUSTAND GANDHINAGAR ROADRAMDURG-591123 DIST:-BELGAUM STATE:- KARNATAKA,INDIA",RAMDURG,KARNATAKA,08335-241098,9663009626,http://www.adarshfoundation.org,adarshfoundation6(at)gmail[dot]com
0,Adarsh Hindi Vidyapeeth,"Kalamman Agasi, Hubli",Hubli,KARNATAKA,0836-4252123,9964515658,Not Available,adarsh[dot]vidyapeeth(at)gmail.com
0,ADARSH VIDYAVARDHAK SANGH,ADARSHA VIDYA VARDHAK SANGHA DESTITUTE COTTAGE NEAR BUS STOPBEWOOR TQ:DUST: BAGALKOT,BEWOOR,KARNATAKA,Not Available,9448816718,Not Available,guru[dot]b.bewoor(at)gmail.com
0,ADARSH WOMEN DEVELOPMENT ASSOCIATION (R),"ADARSH WOMEN DEVELOPMENT ASSOCIATION (R) NAVANAGAR,BAGALKOT",BAGALKOT,KARNATAKA,Not Available,9481981407,Not Available,awdagld(at)yahoo[dot]com
0,Adarsha Education Society,Adarsha Education Society Sangankallu village Bellary Tq and District 583103,Bellary,KARNATAKA,08392-267782,9611967781,Not Available,amshivakumar007(at)gmail[dot]com
0,ADARSHA HINDIVIDYALAYA,"Adarsha Hindi Vidyalaya 43/1-A, First Block, T.R.Nagar, Bangalore-560028 Karnataka INDIA",Bangalre,KARNATAKA,Not Available,9480031118,Not Available,adarshahindi(at)gmail[dot]com
0,ADARSHA MAHILA MANDALI,"ADARSHA MAHILA MANDALI(R)DRAVIDA NILAYA,HADAGALI ROAD,HARAPANAHALLI-583131 DAVANAGERE-DIST",HARAPANAHALLI,KARNATAKA,08398-282244,9449434664,Not Available,bparashuram(at)rediffmail[dot]com
0,ADARSHA RURAL DEVELOPMENT AND TRAINING SOCIETY,"Opp:Housing Board 5th Block, Bagepalli-561207, Chickaballapur District, Karnataka.",Bangalore,KARNATAKA,Not Available,8332840958,Not Available,adarsha1994(at)yahoo[dot]com
0,ADARSHA SAMAJA KARYA SAMSTE,"ADARSHA SAMAJA KARYA SAMSTE (R) DOOR NO. 1107, C-6 CROSS, SHIVAKUMARASWAMY NAGARA 2ND STAGE, DAVANAGERE",DAVANAGERE,KARNATAKA,08192-289643,9845135783,Not Available,manjappa_adarsha(at)yahoo[dot]com
0,ADEPT Educational and Welfare Trust,"No.2/1, 1st cross, Masjid Street, BSA cross, Tannery Road, Bangalore-560005",Bangalore,KARNATAKA,Not Available,8660072706,Not Available,adeptblr(at)gmail[dot]com
0,Adhara Shadja,Adhara Shadja (R) Hirehadda Po: Hukkali Tq: Siddapura (U.K) 581331,Siddapura,KARNATAKA,08389-249429,9449203522,http://adharashadja.wordpress.com,adharashadja(at)gmail[dot]com
0,ADHIRAKSHANA SAMAJA SEVA SAMSTHE,"ADHIRAKSHANA SAMAJA SEVA SAMSTHE(R,)NEAR RAILWAY STATION CHITRADURGA-577501",Chitradurga,KARNATAKA,Not Available,9741883605,Not Available,asssamsthe(at)gmail[dot]com
0,Adichunchanagiri Hospital and Research Centre,"Adichunchanagiri Hospital and Research center Balagangadharanathanagara - 571 448, Nagamangala taluk, Mandya district.",Nagamangala,KARNATAKA,08234-287755,8762557576,http://www.bgsaims.com,purchasebgsaims(at)gmail[dot]com
0,Adidravida Tamate Mattu Nagari Samskruthika Kala Vrunda,No 59B B KeriPulakeshi Road Mysore 570021,MYSURU,KARNATAKA,Not Available,9342005711,Not Available,cmanjunathnagari(at)gmail[dot]com
0,ADIJAMBAVA SHIKSHANA SAMSTHE,ADIJAMBAVA SHIKSHANA SAMSTHEBAPUJI ONI DEVADURGA TQ DEVADURGA,DEVADURGA,KARNATAKA,Not Available,9448633209,Not Available,Adijambava209(at)gmail[dot]com
0,Adishakti Rural Development Society Markumbi,A/P: Markumbi Tq : Savadatti Dist : Belgaum,savadatti,KARNATAKA,Not Available,9611690716,Not Available,ardsmarkumbi(at)yahoo[dot]com
0,ADISHAKTYATMAKA SRI ANNAPOORNESHWARI DEVASTHANADA RAKSHANA PRATHISTHANA,"NO.1, CAR STREET, HORANADU",CHIKMAGALUR,KARNATAKA,Not Available,9448282412,Not Available,gsjoshy(at)gmail[dot]com
0,ADITYA EDUCATIONAL TRUST,"No.174/40, Lucky Paradise, 8th F-Main,22nd Cross, 3rd Block, Jayanagar, angalore.",Bangalore,KARNATAKA,Not Available,9845280559,Not Available,REDDYPRABHAKARA22(at)GMAIL[dot]COM
0,ADMAR MUTT EDUCATION FOUNDATION,"ADMAR MUTT EDUCATION FOUNDATION (POORNAPRAJNA INSTITUTE OF SCIENTIFIC RESEARCH) NO. 4, 16TH CROSS, SADASHIVANAGAR,",BANGALORE,KARNATAKA,Not Available,9986312479,http://www.ppisr.res.in,director(at)poornaprajna[dot]org
0,Adullam Educational Institution,"BM Bypass, 1st Cross, River Road",Hunsur,KARNATAKA,Not Available,9448336761,http://www.adullam.in,adullamschool(at)gmail[dot]com
0,ADVAITA FOUNDATION,"741, V Prasad Complex, 2nd Floor, Opp to Govt Hospital, Sulibele, Main Road, Hoskote Taluk,Bangalore",Bangalore Rural,KARNATAKA,Not Available,9972737610,Not Available,mahanthks32(at)gmail[dot]com
0,ADVAITH VISHWASTHA MANDALA,"DR SV HIREMATH, NO 931, SHRI MAHALAXMI NILAYA, SCHEME 40, KUVEMPU NAGAR, BELAGAVI",BELAGAVI,KARNATAKA,Not Available,9964672452,Not Available,advaithvishwasthamandal(at)gmail[dot]com
0,Advaya Community Trust,"24, Flower Garden Rd, Raja Reddy Layout, Babusabpalya, Hennur",Bangalore,KARNATAKA,Not Available,9986031056,Not Available,vinayakamurthic(at)gmail[dot]com
0,Advi Siddeshwar Rural Development Society,Plot No 2022 Ganesh Circle Opp SBI Ramateerth Nagar Buda Layout Belagavi,Belgaum,KARNATAKA,0831-2423264,9739827589,http://www.asrds.org,asrdsbgm(at)gmail[dot]com
0,AFALAH EDUAIONAL AND MINORITY SOCIEL WELFAR TRUST,ADILPUR TALUK SHAHAPUR DIST YADGIR,SHAHAPUR,KARNATAKA,Not Available,8050488911,Not Available,ALFALAHMINORITYTRUST(at)GMAIL[dot]COM
0,AFTAB EDUCATION TRUST (R),"YERAMARUS CAMP , RAICHUR",RAICHUR,KARNATAKA,Not Available,7022572238,Not Available,aftabeducation2003(at)gmail[dot]com
0,AGAPE BIBLE FELLOWSHIP,NO. 3 CHURCH STREET LINGARAJAPURAM ST. THOMAS TOWN POST,BANGALORE,KARNATAKA,Not Available,7795353391,http://www.agapebangalore.org,ABCABFINDIA(at)GMAIL[dot]COM
0,AGAPE MINISTRIES INDIA,"NO.632, ERAPPA LAYOUT, BANASWADI MAIN ROAD",BANGALORE,KARNATAKA,Not Available,9845214117,Not Available,agape(at)vsnl[dot]com
0,AGASTYA INTERNATIONAL FOUNDATION,"No 101, Varsav Plaza, 12, Jayamahal Main Road, Bangalore",Bangalore,KARNATAKA,080-41124132,9449596360,http://www.agastya.org,agastyaadmin(at)gmail[dot]com
0,Agency for Development Awakening and Rural Self Help Associations,"ADARSHA, Adarshadhama, Vijayanagar, J.M Road 3rd cross",Moodbidri,KARNATAKA,Not Available,9845134707,Not Available,adarsha(at)live[dot]in
0,AGHORI GLOBAL FOUNDATION,AGHORI GLOBAL FOUNDATION No 20 and 21 8 Thapobhoomi 3rd Main 3rd Cross Santhrupthinagar J P Nagar 7th Phase Bangalore 560078,Bangalore,KARNATAKA,080-41157588,8088888688,http://,aghorisa(at)gmail[dot]com
0,AGK EDUCATIONAL TRUST,"Next KEB Office, Anekal Road, Chandapura, Anekal Taluk, Bangalore 560081",Bangalore,KARNATAKA,Not Available,9986682866,Not Available,spehscentre(at)gmail[dot]com
0,Agni Raksha,"Rosey Cottage 58/1 13th main road, J.P Nagar 1st phase, Bangalore560078",Bangalore,KARNATAKA,Not Available,9886066360,http://www.agniraksha.org,agniraksha(at)vsnl[dot]net
0,Agricultural Development And Training Society,ADATS Campus 16th Ward Bagepalli 561207,Bagepalli,KARNATAKA,Not Available,9449730817,http://www.adats.com,mario(at)adats[dot]com
0,Agricultural Science Foundation,Agricultural Science Foundation At Post.: Hulkoti - 582205 Dist.: Gadag Karnataka State,Dharwad,KARNATAKA,08372-289069,9448358772,http://www.khpkvk.org,asf_hulkoti(at)yahoo[dot]co.in
0,AGSK SAMSTHE,AMARESWAR GRAMINABHIVRUDDHI SHIKSAN MATTU KALYAN SAMSTHE( AGSK SAMSTHE) MILLENNIUM CAMPUS DADEGAL KOPPAL-583231,KOPPAL,KARNATAKA,08539-200552,9448118985,http://mgikoppal.org,kanavigirish(at)yahoo[dot]com
0,AHI EDUCATION AND WELFARE ASSOCIATION(MINORITY),"K R NAGAR,1ST MAIN,HARIHARA",HARIHARA,KARNATAKA,Not Available,9740111571,Not Available,hmrpatel1234(at)gmail[dot]com
0,AHP-Action on Hunger And Poverty Foundation,"2B, WOOD SIDE APARTMENTS, NO. 77, NGEF, LAY OUT, 50FT ROAD, 5TH CROSS, SANJAY NAGAR, BANGALORE 560094",BANGALORE,KARNATAKA,Not Available,9910334754,http://www.ahp.org.in,saraswathi[dot]rao(at)ahp.org.in
0,Ahum Trust,B-001 Southridge Apartments Behind Jakkur Flying Club jakkur Bangalore-560064,Bangalore,KARNATAKA,Not Available,9886334046,https://www.ahum.in/,contact(at)ahum[dot]in
0,AIC NCore Developmental Impact Foundation,"140, Ballezea, Narayanaghatta Village, Muthanallur Circle, Anekal, Bangalore 560099, Karnataka",BENGALURU,KARNATAKA,Not Available,9746024067,Not Available,sudha(at)thenudge[dot]org
0,AIF OF MOTOR VEHICLE DEPARTMENT TECHNICAL EXECUTIVE OFFICERS ASSOCIATION,"406, Mythri Apts, Judges colony ,R.T.Nagar, Bangalore560032",Bangalore,KARNATAKA,Not Available,9741190000,Not Available,ashahamed78(at)gmail[dot]com
0,AIMS,"AIMS 22, 8TH MAIN, 3RD CROSS, SARASWATHIPURAM, MYSORE570 009",MYSORE,KARNATAKA,Not Available,9845032260,https://www.aimsconsultants.in,sandeepurs(at)aimsconsultants[dot]in
0,Aina Trust,"1487/B, LNR Garden, Kariyanapalya St.Thomas Town Post Bangalore560 084",Bangalore,KARNATAKA,Not Available,8310338040,http://www.ainatrust.in,ainatrust(at)gmail[dot]com
0,Aishwary Mahila Samsthe,"Ganga Nivas, Navarasapur Colony, Opp: New Court, Vijayapur-586101",Vijayapur,KARNATAKA,08352-278197,9342497515,Not Available,rashmichitwadgi(at)gmail[dot]com
0,aishwarya kalanikethana,"Aishwarya Kalanikethana, 1049, M G road, Chikkaballapur district - 562101, Karnataka.",Not Available,KARNATAKA,080-26723849,9448491232,Not Available,aishwarya_kala(at)yahoo[dot]in
0,AJAY WELFARE ASSOCIATION,AJAY DEAF CHILDREN PRIMARY AND HIGH SCHOOL PLOT NO 1228 TATA POWER INDALKO ROAD BELGAUM,BELGAUM,KARNATAKA,Not Available,8660819486,Not Available,ajaydeafschool(at)gmail[dot]com
0,Ajeya Trust,"Moorukaje, Post: Kodangai, Bantwal Taluk, Dakshina Kannada Dist: 574243 Karnataka, lndia.",Moorukaje,KARNATAKA,Not Available,9743383236,http://www.maitreyeegurukulam.com,reco_ravi(at)yahoo[dot]com
0,AJITA MANOCHETANA TRUST,AJITA MANOCHETANA TRUST SUBHAS NAGAR MARATHIKOPPA SIRSI UTTARA KANNADA KARANTAKATA 581402,SIRSI,KARNATAKA,Not Available,9448015942,Not Available,vinayakbhat1964(at)gmail[dot]com
0,Akanksha Charitable Trust,Baipadavu Kabaka Post Puttur taluk,Puttur,KARNATAKA,Not Available,8861938512,Not Available,akaankshatrust(at)gmail[dot]com
0,Akash Institute of Medical Sciences and Research Centre,"akash institute of medical sciences and research center,prasanna halli,devanahalli akash institute of medical sciences and research center,prasanna halli,devanahalli",Devanahalli,KARNATAKA,Not Available,9739096999,http://www.aimsrc.com,drhrsurendra(at)gmail[dot]com
0,AKASH SOCIAL WELFARE AND CULTURAL DEVELOPMENT SOCIETY,"R/O Subhash hadpad, AT: Adki TQ: Sedam DIST: Kalaburgi",Kalaburgi,KARNATAKA,Not Available,9880980981,Not Available,ninganna[dot]pujari2(at)gmail.com
0,Akhanda Seva for International Shanti,"Cave Shiva Temple Chamundi Hill, Mysore 570010",Mysore,KARNATAKA,Not Available,9945100945,http://www.operation-shanti.org,info(at)operation-shanti[dot]org
0,AKHIL BHARAT SARVAKALA TARABETI MATTU SAMSHODHANE SAMSTHE,"AT RATTIHALLI TQ RATTIHALLI DIST, HAVERI, KARNATAKA",HAVERI,KARNATAKA,Not Available,8317421182,Not Available,shrikantkulkarni058(at)gmail[dot]com
0,AKHIL KARNATAKA LINGAYAT DEVELOPMENT SOCIETY,"37, RAMATIRTH GALLI, NEAR KARNATAKA CHOUK, KANABARGI, BELAGAVI590015 KARNATAKA",BELAGAVI,KARNATAKA,Not Available,8792745208,Not Available,akldsbelagavi(at)gmail[dot]com
0,Akhila Karnataka Ganayogi Sangeet Parishat (R) Gadag,"Sri Veereshwara Punyashrama, Panchakshari Nagar, Gadag.",Gadag,KARNATAKA,Not Available,7483991694,Not Available,akgsp248(at)gmail[dot]com
0,AKHILA KARNATAKA KABBIGARA KOOTA TRUST GADAG,AKHILA KARNATAKA KABBIGARA KOOTA TRUST GADAG BASAVESHWAR NAGAR GADAG,GADAG,KARNATAKA,Not Available,9449570249,Not Available,kabbigagdg(at)gmail[dot]com
