,ngo_name,full_address,city,state,contact_1,contact_2,website,mail
0,CSI Redfern Memorial Hospital,"CSI REDFERN MEMORIAL HOSPITALRACE COURSE ROAD,HASSAN",HASSAN,KARNATAKA,Not Available,9901231117,Not Available,csi_rmh(at)rediffmail[dot]com
0,CUDDAPAH SRI PARAMAHAMSA SACHIDANANDA YOGEESWAR MATHALAYAM,"NO.41,1ST MAIN, KEMPAPURA AGRAHARA, BHUVANESHWARINAGAR, BANGALORE",BANGALORE,KARNATAKA,Not Available,9980148138,Not Available,cuddapahswamymutt(at)gmail[dot]com
0,CULTURAL EMPOWER SOCIETY,MANCHANAHALLI VILLAGE 7 POST CHICKBALLAPURA TALUK,BANGALORE,KARNATAKA,Not Available,8296478329,Not Available,empowersociety22(at)gmail[dot]com
0,Current Science Association,Current Science Association CV Raman Avenue Post Box No 8001 Sadashivanagar Post Bangalore 560 080,Bangalore,KARNATAKA,080-23612310,9844079282,http://www.currentscience.ac.in,madhavan(at)ias[dot]ac.in
0,D L SPITI BUDDHIST CULTURAL ASSOCIATION,"LAMA CAMP NO 2 TIBETIAN COLONY, MUNDGOD- 581411",MUNDGOD,KARNATAKA,Not Available,7760553900,Not Available,Lobsangjinpa86(at)yahoo[dot]com
0,DA PAM PUTTARAJA SEVA SAMITI,yadgir Taluk YadagiriDistrict,yadagir,KARNATAKA,Not Available,9972933763,Not Available,puttarajsevasamitiydg(at)gmail[dot]com
0,DADA AMAR CHARITABLE TRUST,"No. 12, 2nd Cross, Nehrunagar,",Bangalore,KARNATAKA,Not Available,9845055655,Not Available,ashok_darya(at)hotmail[dot]com
0,DAIRY DEVELOPMENT SOCIETY,ADATS CAMPUS BAGEPALLI,BAGEPALLI,KARNATAKA,Not Available,9900043029,Not Available,vivy(at)fairclimate[dot]com
0,Daksh Society,"No. 62/1, Palace Road, Vasanthnagar Bangalore, Karnataka, Bangalore urban District, Pin Code: 560 052",Bangalore,KARNATAKA,Not Available,9886027804,http://dakshindia.org/,harish(at)dakshindia[dot]org
0,Daksha Shah Charitable Trust,"13, RAILWAY PARALLEL ROAD KUMARA PARK EAST",BANGALORE,KARNATAKA,Not Available,9845040817,Not Available,nss(at)sapnaonline[dot]com
0,Dakshedte Trust,ASHOKA ROAD BELVAI KARKALA TALUK UDUPI,MANGALORE,KARNATAKA,Not Available,9448253777,Not Available,edwinwalter2525(at)gmail[dot]com
0,Dakshin Foundation,"Dakshin Foundation Flat No A 001, Samvriddhi Gardenia Apartments, Railway Parallel Road, 88/3, Bytaranapura, Near Sahakarnagar A Block.",Bangalore,KARNATAKA,Not Available,7022388061,http://www.dakshin.org/,naveen[dot]namboo(at)gmail.com
0,DAKSHINA BHARAT HINDI PRACHARA SABHA,"P.B NO 42,D C COMPOUND, DHARWAD",Dharwad,KARNATAKA,Not Available,8050328242,Not Available,dbhpsabha(at)gmail[dot]com
0,DAKSHINA KANNADA VISHWA BRAHMANA SANGHA,"DAKSHINA KANNADA VISHWABRAHMANA SANGHA (R) CA-21, Sector ""A"" Vishwakarmena Dhamna Vishwakarmena Dhamna Road Yelahanka Upanagar",BENGALURU,KARNATAKA,Not Available,9845500883,http://www.dkvsangha.com,tilakacharya(at)gmail[dot]com
0,DAKSHINA KARNATAKA SUNNI CENTRE(R) 2ND FLOOR PAVOOR COMPLEX NELLIKAI ROAD MANGALORE-575001,"2ND FLOOR,PAVOOR COMPLEX,NELLIKAI ROAD MANGALORE-575001",MANGALORE,KARNATAKA,Not Available,9845413529,Not Available,principal[dot]ihsan(at)gmail.com
0,DALAPATI SAMANYA SEVA SANGHA (SC),"DALAPATI SAMANYA SEVA SANGHALIG-C-36, BLOCK NO 2, SHRI MUKUNDA NILAYA CHAITANYA NAGAR ,DHARWAD",DHARWAD,KARNATAKA,Not Available,9945131976,Not Available,dsssocietydwd(at)gmail[dot]com
0,DALAYATH SUBAN SAB WELFARE And EDUCATIONAL TRUST,"199, ward no.5 , Holagundi , Huvina hadagalli (Tq) bellary (dist) Karnataka . pin code : 583219",HUVINA HADAGALI,KARNATAKA,Not Available,9008561123,Not Available,dalayathabdulrafi(at)gmail[dot]com
0,Damaruga Ranga Sampanmoola Kendra,"Melehalli, Bramsandra Post, Tumkur Taluk and District",Tumkur,KARNATAKA,Not Available,9611745022,Not Available,damaruga(at)gmail[dot]com
0,DARESA FOUNDATION,"No. 62, SANNIDHI , 80 FT RD. SBM COLONY, BSK 1ST STAGE BANGALORE-560050",Bengaluru,KARNATAKA,Not Available,7353154062,http://abhayacorp.com/daresafoundation/,srtutorials(at)gmail[dot]com
0,darul rahma for education and charity,"BANDIHATTY ROAD, NEAR DHOBI GHAT, COWL BAZAR, BALLARI, BALLARI DIST, 583102",BELLARY,KARNATAKA,Not Available,9611202691,Not Available,sqf786(at)gmail[dot]com
0,DARUL ULOOM HAZRATH QATE-JATUL KUBRA (R.A),"RAZAULLA MUSTAFA NAGARA,7TH CROSS,SIR MIRZA ISMAIL NAGARA, B D LAYOUT,DAVANAGERE",DAVANAGERE,KARNATAKA,Not Available,9035213084,Not Available,rahamatullasabr18(at)gmail[dot]com
0,DARUL ULOOM JAMIA RAZAVIA,"Darul Uloom Jamia Razavia LIG || KHB Colony Gopala, Shimoga",shimoga,KARNATAKA,Not Available,8618197033,Not Available,JAMIARIDAWIYA(at)GMAIL[dot]COM
0,DARUL ULOOM JAMIYA RIZVIA,No 146 28th ward Near SardaariyaSMASJID Sardaar mohalla,Hosapete,KARNATAKA,Not Available,9916611045,Not Available,jamiyarizvia(at)gmail[dot]com
0,DARUL ULOOM RAZA ULMUSTAFA,"RAZAUL MUSTAFA NAGARA,2nd Main,Davanagere",DAVANAGERE,KARNATAKA,Not Available,9448021985,Not Available,khadhar78692(at)gmail[dot]com
0,DAS CHARITABLE SEVA TRUST,Sri Durga Nilaya Ambika Road Ullal Post Mangalore -575020 DK District,MANGALORE,KARNATAKA,Not Available,9164707515,Not Available,dascharitablesevatrust(at)yahoo[dot]com
0,DATE CHARITABLE SOCIETY R,"NIDHI BUILDING, HOSURAPPA LAYOUT, TURUVANUR ROAD, CHITRADURGA",CHITRADURGA,KARNATAKA,08194-231800,9845509861,Not Available,date_durga(at)rediffmail[dot]com
0,DAUGHTERS OF DIVINE PROVIDENCE BANGALORE,"MANINI HOUSE,21 BALAJI LAY OUT COOKETOWN",BANGALORE,KARNATAKA,Not Available,9686642624,Not Available,fdpmanininivas(at)gmail[dot]com
0,DAUGHTERS OF HEART OF MARY KARNATAKA,MARIA NILAYA CHURCH ROAD HONNAVAR-581334,HONNAVAR,KARNATAKA,Not Available,9481312721,Not Available,marianilaya(at)gmail[dot]com
0,DAUGHTERS OF HOPE PROJECT,"NO.6/1, BYRATHI VILLAGE, DODDAGUBBI CROSS, NEXT TO LEGACY SCHOOL",BANGALORE,KARNATAKA,Not Available,9901744394,Not Available,anita[dot]anitashiny(at)gmail.com
0,Daughters of Our Lady of Mercy,Old HD Kote Road N H Palya,Mysore,KARNATAKA,Not Available,9449797960,Not Available,avamysore(at)yahoo[dot]co.in
0,Daughters of St. Francis De Sales,"daughters of st.francis de sales, kammasandra village, electronies",Bangalore,KARNATAKA,Not Available,8105312210,Not Available,theresepdsfs(at)gmail[dot]com
0,Daughters of St. Mary of Providence,"4/1, JOHN ARMSTRONG ROAD, RICHARDS TOWNBangalore560084",Bangalore,KARNATAKA,Not Available,9008066036,Not Available,dsmpblor(at)gmail[dot]com
0,DAUGHTERS OF ST.PAUL,"15, Albert Street,Richmond Town,Bangalore",Bangalore,KARNATAKA,Not Available,8095957758,Not Available,paulinebangalore(at)gmail[dot]com
0,Davangere Jilla Shishu Kalyana Mandali,"DAVANGERE JILLA SHISHU KALYANA MANADALI VANITHA SAMAJA BUILDING, 2ND MAIN, 2ND CROSS, P.J. EXTENSION. DAVANGERE- 577002KARNATAKA STATE",Davangere,KARNATAKA,Not Available,9448948450,Not Available,dvg[dot]awtc(at)yahoo.com
0,DAYA NILAYA,Daya Nilaya TrustUrsuline Convent26 Davis Road Bangalore-560084,BANGALORE,KARNATAKA,Not Available,8291334588,Not Available,kripaumi(at)gmail[dot]com
0,Daya Rupa Ashram Charitable Trust,"Site No. 57, Sridevi Nilayam, Beechi Nagar, Kappagal Road, Ballari -583101",Ballari,KARNATAKA,Not Available,8985251969,Not Available,dayarupaact2019(at)gmail[dot]com
0,Dayalbagh Ashram,"POST NO. 1, UJIRE-LOCALITY BELTANGADY TALUK KARNATAKA PIN 574240",BELTANGADY,KARNATAKA,Not Available,8722145646,Not Available,dayalbaghujire(at)gmail[dot]com
0,DAYAMAYI SEVA TRUST,"208,RAJGOPALROAD ,OPP MILLINIUM SCHOOL, SANJAYNAGAR - POST, NAGASHETTYHALLI ,BENGALURU -560094",BENGALURU,KARNATAKA,Not Available,9148475858,Not Available,dmstblr2017(at)gmail[dot]com
0,DAYANAND RURAL URBAN AND EDUCATION DEVELOPMENT SOCIETY SC MANAGEMENT,At: Post: Chawar Dapka Tq: Aurad (B) Dist: Bidar-585326,BIDAR,KARNATAKA,Not Available,7795790143,Not Available,dayanandeducationsociety(at)gmail[dot]com
0,Dayananda Sagar Entrepreneurship Research and Business Incubation Foundation,"44/54, 30TH CROSS, TILAK NAGAR EXTENSION, BENGALURU560041",BANGALORE,KARNATAKA,Not Available,9449963390,http://www.derbifoundation.com/,coo(at)derbifoundation[dot]com
0,DAYANANDA SAGAR UNIVERSITY,"Kudlu Gate, Hosur Main Road, Bangalore 560068",Bangalore,KARNATAKA,Not Available,9880283288,http://www.dsu.edu.in,dean-engg(at)dsu[dot]edu.in
0,DE PAUL SERVICE SOCIETY,"DE PAUL SERVICE SOCIETY KUMBALAGOD P.O. BANGALORE-560 074, KARNATAKA",BANGALORE,KARNATAKA,Not Available,8970141479,Not Available,royvvc(at)gmail[dot]com
0,Deejay Agri Support Foundation,"H.No. 16, SHALOM, Convent Road, Residency Road, Benglore 560025",Benglore,KARNATAKA,Not Available,9071383250,https://dasf.org.in/,support(at)dasf[dot]org.in
0,DEEKSHA,Deeksha Sriramnagar Attikolla Dharwad,Dharwad,KARNATAKA,Not Available,9449207919,http://www.deekshatrust.com,linnetdsilva(at)yahoo[dot]com
0,DEEKSHITHA CHARITABLE CULTURE TRUST R,74 BANDARALAHALLI VILLAGE C K HALLI POST NAGARAGERE HOBLI,GOWRIBIDNAUR TALUK,KARNATAKA,Not Available,9036601487,Not Available,deekshithatrust(at)gmail[dot]com
0,Deena Seva Sanga,"No22, Risaldar Street, Seshadripuram, Bengaluru-560020",Bengaluru,KARNATAKA,Not Available,7676468605,Not Available,dss1718(at)yahoo[dot]com
0,DEENABANDHU (R),PWD COLONY NEAR FOREST NURSERY CHAMARAJANGARA,CHAMARAJANAGARA,KARNATAKA,Not Available,9448871813,Not Available,deenabandhutrust(at)gmail[dot]com
0,DEENASHRAMA,DEENAASHRAM BOYS HOME SHIVAJI ROAD NR MOHALLA MYSORE,MYSORE,KARNATAKA,Not Available,9845259128,Not Available,mariraj_16(at)rediffmail[dot]com
0,Deepa Academy for the Differently Abled,"No 226/A, Tank Bund Road, Subramanyanagar, Bangalore",Bangalore,KARNATAKA,Not Available,9980368431,Not Available,deepa[dot]academy(at)gmail.com
0,DEEPA SAMAJA SEVA KENDRA,WARD NO. 30 GAYATRI PEETHA HAMPT-583239 TALUK: HOSPETE DISTRICT : BELLARY KARNATAKA,HOSPET,KARNATAKA,Not Available,9164635655,http://ngoinbangalore.com/,deepa[dot]sevakendra(at)gmail.com
0,DEEPANKAR CHARITY FOUNDATION,Warwatti Warwatti B Bidar Bhalki Karnataka State,Bidar,KARNATAKA,Not Available,9845837999,Not Available,deepankarngobidar(at)gmail[dot]com
0,DEFY educational organisation,302 HRC ANANYA APTS JUDICIAL LAYOUT ALLALASANDRA YELAHANKA NEW TOWN,Bangalore,KARNATAKA,Not Available,8861496608,http://www.projectdefy.org,abhijit(at)projectdefy[dot]org
0,DESHPANDE EDUCATIONAL TRUST,DCSE BUILDING BVBVCET CAMPUS VIDYANAGAR,HUBBALLI,KARNATAKA,Not Available,9845267711,https://www.detedu.org/,CHAKRAVARTHY[dot]VASUDEVAN(at)DFMAIL.ORG
0,DESHPANDE FOUNDATION,DCSE Building BVBCET Campus Vidyanagar,HUBLI,KARNATAKA,Not Available,9591217091,http://www.deshpandefoundationindia.org/,ceo(at)dfmail[dot]org
0,DESI POWER FOUNDATION,"4, 2nd Floor, 4th Main, KHM Block, R.T Nagar Main Road, Banglore-560032",Banglore,KARNATAKA,Not Available,9991737733,Not Available,deepak[dot]das(at)desipowerfoundation.org
0,DESITRUST,"NO.27, PATALAMMA TEMPLE STREET, NEAR SOUTH END CIRCLE, BASAVANAGUDI,",BANGALORE,KARNATAKA,Not Available,9620565847,http://desitrust.com/,desitrust(at)gmail[dot]com
0,Devaji Naik Education Society Shanti Nagar Kalburgi (R) 585103 karnataka State,"H.No LIg 12 MSK Mill Road , KHB Colony, Shanti Nagar Kalburgi 585103",Gulbarga,KARNATAKA,Not Available,9448125905,Not Available,vithaljadhav1956(at)gmail[dot]com
0,Devaloka Trust,"No. 60/3,first floor,near royal legends apts, devarachikkanahalli road, bommanahalli, bangalore 560068",Bangalore,KARNATAKA,Not Available,7022075522,http://www.devalokatrust.com,devalokatrust(at)gmail[dot]com
0,DEVAMATHA EDUCATIONAL FOUNDATION,"Dharmaram College,Dharmaram P.O,Bangalore-29",Bangalore,KARNATAKA,Not Available,9972611227,Not Available,office(at)caias[dot]in
0,DEVANGA SAMAJA,"NEAR TUNGABHADRA RIVER,BHANASHANKARI TEMPLE",DAVANAGERE,KARNATAKA,Not Available,9844643483,Not Available,mudugal84(at)gmail[dot]com
0,Devanga Sangha,No 14 Devanga hostel road 10th main Sampangi ramnagar,Bengaluru,KARNATAKA,Not Available,9341905458,Not Available,devangasangha1924(at)gmail[dot]com
0,Development Education Service (DEEDS),"Flat-A , 1st floor, Anand Apartments, Vasanthi Complex , Kadri, Mangaluru, Dakshina Kannada, Karnataka, 575002",Mangaluru,KARNATAKA,Not Available,9448119827,http://www.deeds.org.in,merlmartis(at)gmail[dot]com
0,DEVELOPMENT FOCUS,"917, 9TH B MAIN, 3RD C CROSS, KALYANNAGAR BANGALORE-560043",BANGALORE,KARNATAKA,Not Available,9844124874,Not Available,df(at)devfocus[dot]in
0,DEVELOPMENT INITIATIVES FOR SUSTAINABLE HUMAN ADVANCEMENT(DISHA),"D.No.6-161,V.V.Compound Salmara, Kaikamba,Muloor villageKinnikambla Post-574151 MangaluruDakshina Kannada District, Karnataka,India",Mangaluru,KARNATAKA,Not Available,9448529361,https://dishatrustorg.wordpress.com/,dishatrust(at)gmail[dot]com
0,Development Intiatives for Human and Natural Resources,1st floorNear Sai baba mandira road Bhakthanagari N R Extension Chintamani,CHINTAMANI,KARNATAKA,Not Available,9448345812,Not Available,hadrin2009(at)rediffmail[dot]com
0,Development Makers And Centre For Overall Developments,"Neelakteshwara Building, 2nd Floor,Opp.Ashok Book Stall,Near KSRTC Bus Stand, Hospet583201 Bellary District, Karnataka State",Hospet,KARNATAKA,Not Available,8050102857,Not Available,developmentmaker2007(at)gmail[dot]com
0,DEVELOPMENT OF RURAL ARTISTS MUSICIANS ASSOCIATION DARAMA,MULKI POST AURUD TALUK BIDAR DISTRICT,BIDAR,KARNATAKA,Not Available,9008057294,Not Available,drama[dot]org2001(at)gmail.com
0,Development through Education And Rehabilitation,"63, BORNMANN ENCLAVE, KOTHANUR, BANGALORE-77",BANGALORE,KARNATAKA,Not Available,9844604133,Not Available,dearindia2011(at)gmail[dot]com
0,DEVI MAHILA MANDALI,"H.NO: 1-3-322, Near Budi Baba Darga, Ashapur Road, Raichur",Raichur,KARNATAKA,Not Available,9972466695,Not Available,venkatasaigv(at)gmail[dot]com
0,DEVISHRI GRAMEENA ABHIVRUDDHI SHIKSHANA SAMSTHE,WARD NO 4 KANAKAGIRI TALUK GANGAVATHI DIST KOPPAL,GANGAVATHI,KARNATAKA,Not Available,9449206266,Not Available,chandrashekhara12mahipati(at)gmail[dot]com
0,Dhaatu,"3944/F, 17th D cross, 4th Main, BSK II Stage, Bangalore-560070",Bangalore,KARNATAKA,Not Available,9886444593,http://dhaatu.org/,dhaatu(at)gmail[dot]com
0,DHANVANTHRI HOSPITAL SOCIETY,No 1 Moore Market Square Bourdillon Road Frazer Town Bangalore 560 005,BENGALURU,KARNATAKA,Not Available,9844233958,Not Available,anantharam[dot]ba(at)gmail.com
0,DHARAMARAM COLLEGE,"Dharmaram College Post, Bannerghatta Road,Bangalore560029",Bangalore,KARNATAKA,Not Available,9916437610,Not Available,mailtosfa(at)gmail[dot]com
0,Dhareshwara Yakshabalaga Charitable Trust,Chandrama Post : Kirimanjeshwara Taluk : Kundapura District : Udupi Karnataka State,Byndoor,KARNATAKA,Not Available,9886833680,Not Available,dhareshwarayakshabalaga(at)gmail[dot]com
0,DHARI DEEPA MAHILA SANGHA,"NO 482/B, 3RD STAGE, 1ST BLOCK, 2ND CROSS, BASAVESHWARANAGAR, BENGALURU",BENGALURU,KARNATAKA,Not Available,9986629955,Not Available,ramaramesh9986(at)gmail[dot]com
0,Dharithree,"No.46,1st main, behind TTD temple, Vyalikavall, Bangalore-560003",Bangalore,KARNATAKA,080-23567518,9448353888,http://www.dharithree.org,Dharithreetrust2018(at)gmail[dot]com
0,Dharma Chakra Trust,"Vidyamandira, No 2/A, JP Road, First Phase, Girinagara, Bangalore 560085.",Bangalore,KARNATAKA,Not Available,9449595208,Not Available,madhukb4(at)gmail[dot]com
0,DHARMA JYOTHY CHARITABLE SOCIETY,QUEEN OF APOSTLES CONVENT VAMANJOOR MANGALORE,Mangaluru,KARNATAKA,Not Available,9448073400,Not Available,dharmajyothisra(at)gmail[dot]com
0,Dharma Megha Trust,"Venkatesha Krupa, Ayyappa Nagara, Mallandur Road",Chikmagalur,KARNATAKA,Not Available,9986846635,Not Available,drchandrusarja(at)gmail[dot]com
0,DHARMA VARDHINI ANNA SATHRA ASHRAMA TRUST,"SY.NO. 724/3, GOSAI GHAT, GANJAM, SRIRANGAPATNA TOWN",MANDYA,KARNATAKA,Not Available,7760749700,Not Available,yajurvediharisha(at)gmail[dot]com
0,dharmagiri social welfare and development trust,No 9 O B Choodahalli Udayapura Post Near Art of Living Bangalore 560082,BANGALORE,KARNATAKA,Not Available,9481250076,http://www2.ngoportal.org/ngo-database-4430-DHARMA,mukundakdswdt(at)gmail[dot]com
0,DHARMARAM VIDYA KSHETRAM,"DHARMARAM COLLEGE POST, BANNERGHATTA ROAD",Bangalore,KARNATAKA,Not Available,9481887205,Not Available,dvkfinanceoffice(at)gmail[dot]com
0,DHARMASTHALA MANJUNATHESHHWARA EDUCATIONAL TRUST (REGD),"DHARMASTHALA MANJUNATHESHHWARA EDUCATIONAL TRUST (REGD) BELTHANGADY TALUK, DAKSHINA KANNADA 574 240",UJIRE,KARNATAKA,Not Available,9036720036,http://www.sdmesociety.in/,coordinatormltcujire(at)gmail[dot]com
0,DHARMASTHALA MANJUNATHESWWARA EDUCATIONAL SOCIETY (REGD),"SDM Eductional Society (R)Ujire, Belthangady Taluk Dakshina Kannada District574240",Ujire,KARNATAKA,Not Available,9448252696,http://www.sdminstitutions.com,ho(at)sdmesociety[dot]in
0,DHARWAD DIST ANJUMAN E ISLAM,"Goods Shed Road, Block 3Kulkarni Hakkal Hubli 580020",Hubballi,KARNATAKA,Not Available,9448326177,Not Available,h[dot]jamaluddin(at)gmail.com
0,Dharwad jilla girijan vivdh uddheshagal (lamps) sahakari sangha (r).hubli,Keteshwar Colony R.N.Shetty Road Old Hubballi Hubballi Dist Dharwad State -Karnataka,HUBBALLI,KARNATAKA,Not Available,9880857255,Not Available,halapetiyk(at)gmail[dot]com
0,DHARWAD JILLA KANNADA SAHITYA PARISHATTU,"DHARWAD JILLA KANNADA SAHITYA PARISHATTUSAHITYA BHAVAN ,NEAR R N SHETTY STADIUM , DHARWAD",DHARWAD,KARNATAKA,Not Available,9449447488,Not Available,suchit[dot]angadi09(at)gmail.com
0,DHARWAD SALESIAN SOCIETY,"DON BOSCO ACADEMY, NAVNAGAR P.O, SUTGATTI, HUBBALLI-580025",HUBLI,KARNATAKA,Not Available,9538049719,Not Available,dbahubli(at)gmail[dot]com
0,DHEESMRUTHI CULTURAL TRUST,"94/96,LIG GROUP-1, K H B Colony, Hootgalli, Mysore, Mysore district",Mysore,KARNATAKA,Not Available,9845514670,Not Available,dheesmruthi(at)gmail[dot]com
0,DHRUSHYA,"DHRUSHYA (R), No.58, 2nd Cross, R.K.Layout, K.G.Nagar, Bangalore",Bangalore,KARNATAKA,08398-282244,9036992658,Not Available,dakshayani07(at)gmail[dot]com
0,Dhwani Foundation,"""Nirvana"" No.329, 18th Cross, Ideal Homes Layout, 1st Phase, Raja Rajeshwari Nagar",Bangalore,KARNATAKA,Not Available,9739444818,http://www.dhwani.1ngo.in,absar(at)dhwanifoundation[dot]com
0,Dhwani Institute For Rural Development,"Dhwani Institute for Rural Development, T.B. Extension, Nagamanagala-571432 Mandya District",Nagamangala,KARNATAKA,08234-285450,9448494414,Not Available,dhwani94ccc(at)yahoo[dot]in
0,DHWANI TRUST,"NO.13, 8TH MAIN,AGRAHARA DASARHALLI",Bengaluru,KARNATAKA,Not Available,9663455891,http://www.dhwanitrust.org,dhwanitrust(at)gmail[dot]com
0,DHYANA PEETA CHARITABLE TRUST,"Nithyanandapuri,Mysore Road,Kallugopahalli,Bidadi",Bengaluru,KARNATAKA,Not Available,9969234256,Not Available,accounts(at)nithynanda[dot]org
0,DHYANVANA,RS NAIDU NAGAR KESARE NR MOHALLA,MYSORE,KARNATAKA,Not Available,9482944396,Not Available,dhyanavana(at)gmail[dot]com
0,DIAMOND EDUCATION SOCIETY VIJAYAPUR,DIAMOND EDUCATION SOCIETY GOPALPUR GALLI NEAR SANGALIKAR CHAL BIJAPUR KARANATAKA INDIA,BIJAPUR,KARNATAKA,08352-240426,9945110426,http://www.dssbkiedu.com,diamonddssbki(at)gmail[dot]com
0,DIDIER CHARITABLE TRUST,"255/2/10 Kothanur Village and Post, Hennur Bagalur Road, Karnataka, Bangalore -560077",Bangalore,KARNATAKA,Not Available,9900071992,Not Available,morningstarblr(at)yahoo[dot]com
0,DIGITAL DISCOURSE FOUNDATION,"1/01, New 03 ,Police Station RD Basavanagudi Bangalore Bangalore KA 560004 India",Bangalore,KARNATAKA,Not Available,9448055645,Not Available,director(at)digitaldiscourse[dot]org.in
0,DIKSHA CHARITABLE TRUST,H. NO. 15-4-343 GANESH NAGAR BIDAR,BIDAR,KARNATAKA,Not Available,9741436432,Not Available,ashokumarr70(at)gmail[dot]com
0,Dildar educational and minority social welfare trust,"H.No. 13/2/35 Dhulpet mohalla Timmapur Tq, Shorapur Dist, Yadgir",Shorapur,KARNATAKA,Not Available,9886206015,Not Available,dildarminoritytrust(at)gmail[dot]com
0,DILERBASHA EDUCATIONAL WELFARE ASSOCIATION,"DILERBASHA EDUCATIONAL WELFARE ASSOCIATION AT :KORIPETE ,SAVANUR-581118 TQ: SAVANURDIST:HAVERI",SAVANUR,KARNATAKA,Not Available,9008307832,Not Available,ss[dot]abrar24(at)gmail.com
0,Dimensions Centre for Child Development,"No 1336, 2nd Cross, Nanjappa Layout, Babusapalya, Bangalore560043",Bangalore,KARNATAKA,Not Available,9980746677,http://www.dimensionstherapy.org,info(at)dimensionstherapy[dot]org
0,DINANILAYA SOCIAL CENTRE,"DINANILAYA SOCIAL CENTRE, KOTHANUR P.O. , BAGALUR ROAD .",BANGALORE,KARNATAKA,Not Available,9741420706,Not Available,dinanilayasocialcenter(at)gmail[dot]com
0,dinesh joshi foundation,"No 34, 2nd cross Amarjyothinagar Vijanagar Bangalore-560040",BANGALORE,KARNATAKA,Not Available,9448087391,Not Available,dnjoshi1970(at)gmail[dot]com
0,Diocese of Belthangady,DIOCESE OF BELTHANGADY UDAYANAGAR BELTHANGADY,BELTHANGADY,KARNATAKA,Not Available,9448428942,Not Available,dioceseofbelthangady(at)gmail[dot]com
0,Diocese Of Chickmaglor,"Bishops Office, Jyothi Nilaya, Jyothinagara post, Chikmagalur 577102",CHIKMAGALUR,KARNATAKA,Not Available,9448775487,Not Available,tomrosario1965(at)gmail[dot]com
0,DIOCESE OF GULBARGA,"KRIPALAYA, Bishops House Kotnoor D Village, Jewargi Raod Near Kendriya Vidyalaya, Nandikoor Post Kalaburagi585102",Gulbarga,KARNATAKA,Not Available,8147172334,http://www.gulbargadiocese.org,gulbargadiocese(at)gmail[dot]com
0,DIOCESE OF MANGALORE,"Bishops House, Kodialbail",Mangalore,KARNATAKA,Not Available,8105573673,Not Available,procuratordom(at)gmail[dot]com
0,Diocese of Shimoga,"Bishops House Malligemane Malligenahalli, Sagar Road Shimoga577205 Karnataka, INDIA",Shimoga,KARNATAKA,Not Available,8277557247,http://www.shimogadiocese.org/,cliffpin76(at)gmail[dot]com
0,DIOCESE OF UDUPI,Bishops House,Udupi,KARNATAKA,Not Available,9481466133,http://www.udupidiocese.in,rodzare(at)yahoo[dot]com
0,DIP RURAL EDUCATIONAL BOARD And CHARITABLE TRUST,"NO 16,BUILDING ADJECENT TO PRASANNA THEATRE,MAGADI ROAD,BANGLORE-560023",BANGALORE,KARNATAKA,Not Available,9513855009,Not Available,aksharainfosolutions(at)gmail[dot]com
0,DISABILITY NGOS ALLIANCE (DNA),"Care of Association of People with Disability (APD), 6th Cross, Hutchins Road, Lingarajpuram",Bangalore,KARNATAKA,Not Available,7349377793,http://www.disabilityngosalliance.org/,jyothi(at)dna-india[dot]org
0,Discalced Carmelite Karnataka Goa Province,3-13-1246 Carmel Hill Kulshekar,MANGLORE,KARNATAKA,Not Available,9448952356,Not Available,dckgprovince(at)rediffmail[dot]com
0,DISTRESS CALL MISSION,SUNDARANAGARA KAMAGERE KOLLEGALA TALUK CHAMARAJANAGAR DISTRICT KARNATAKA STATE,CHAMARAJANAGAR,KARNATAKA,Not Available,9900115100,Not Available,founder[dot]distresscallmission(at)gmail.com
0,District Hindi Premi Mandal Minority Education Trust,"Door No 10/149, Opp Elahi Masjid, Pathakandakam Street, Near Water Tank",Bellary,KARNATAKA,Not Available,8660523653,Not Available,dhpmmetb(at)gmail[dot]com
0,DISTRICT MUSLIM WELFARE,"TIPPU SULTHAN HIGH SCHOOL GANDHI NAGAR AT/PO-HUKKERI-591309,DIST- BELGAUM",BELAGAVI,KARNATAKA,Not Available,9986228992,http://dmwes.org,iapeerzade(at)gmail[dot]com
0,district reddy janasangha,"8th main, winsent building, ashok nagar, tumkur",tumkur,KARNATAKA,Not Available,8095284042,Not Available,rjstumkur(at)gmail[dot]com
0,Divine Educational and Charitable Trust,"Mezzanine Floor, BMTC - TTMC Bldg, Domlur, Bengaluru - 560071, India",bangalore,KARNATAKA,080-41639187,9916128533,Not Available,biovision1(at)yahoo[dot]com
0,DIVINE GENERATION MINISTR,"DGMBC TRUST(R),Bethel Church Road, Innanje Village, Shankarpura Post 574115, Udupi",Udupi,KARNATAKA,Not Available,9902334941,http://www.dgmbethelchurch.org/,dgmofficial(at)gmail[dot]com
0,DIVINE LIGHT CHARITABLE TRUST,"EL SHADDAI, NO 13/2, 2ND CROSS BESIDE ASSISI CHURCH, HENNUR ROAD, KARNATAKA BANK",BANGALORE,KARNATAKA,Not Available,9986025562,Not Available,divinelight[dot]ct(at)gmail.com
0,DIVINE LIGHT MINISTRIES,"El shaddai, 13/2, Beside Assisi Church, Hennur Road, Bangalore",Bangalore,KARNATAKA,Not Available,9343941005,Not Available,divinelig[dot]ministries(at)gmail.com
0,DIVINE LIGHT TRUST FOR THE BLIND,Whitefield mainroad,Bangalore,KARNATAKA,Not Available,9448810689,Not Available,dltb(at)rediffmail[dot]com
0,DIVY DARSHAN GRAMEEN ABHIVRADHI HAGU SWAYAM UDYOG TARABETI SANSTHE BAGALKOT,"Basaveshwar Engineering College Road, 19th Main Road, Vijayanagar, Vidyagiri, Bagalkot-587102.",BAGALKOT,KARNATAKA,Not Available,9980174819,http://www.divyadarshan.org.in,pralhadbhovi(at)yahoo[dot]in
0,Divya Deepa Charitable Trust,"Divya Deepa Charitable Trust Kenchalagudu village, Manandavadi Road, Rayanakere post Mysore",Mysore,KARNATAKA,Not Available,9341369901,http://www.divyadeepatrust.org,divyadeepa[dot]trust(at)gmail.com
0,DIVYA DOWNS DEVELOPMENT TRUST,"3rd main, 4th cross, Janet building, Nearbus stopopp SBI ATM, Viveknagar, Bangalore",Bengaluru,KARNATAKA,Not Available,9845540303,Not Available,estherthom(at)gmail[dot]com
0,DIVYA JOTHI CULTURAL ASSOCIATION,"BHARAMA SAGARA 577519 , CHITRADURGA TQ , CHITRADURGA DIST , KARNATAKA",CHITRADURGA,KARNATAKA,Not Available,7975165067,Not Available,divyajyothica6(at)gmail[dot]com
0,Divya Jyothi Charitable Trust,"Door No. 151-f, 4th Cross, Gokulam 3rd Stage, Mysore - 570002",Mysore,KARNATAKA,0821-2510129,9886409563,http://www.divyajyothitrust.org,divya[dot]jyothi.trust(at)gmail.com
0,DIVYA SHANTHI CHRISTIAN ASSOCIATION,NO.117/4 SAKAMMA LAYOUT H.M.ROAD LINGARAJAPURAM,BANGALORE,KARNATAKA,Not Available,7090663863,Not Available,dscaho(at)gmail[dot]com
0,DIVYA SHANTHI TRUST,NO 117/4 SAKAMMA LAYOUT H M ROAD LINGARAJAPURAM,BANGALORE,KARNATAKA,Not Available,9513188341,Not Available,divyashanthitrust(at)gmail[dot]com
0,Divyaang Myithri Sports Academy,"No 08, Kadiranapalya,Indiranagar Post,Bangalore 560038",Bangalore,KARNATAKA,080-99869611,9986961117,http://www.divyaangmyithri.com,shiva(at)divyaangmyithri[dot]com
0,DIVYADARSHAN RURAL AND URBAN DEVEOPMENT SOCIETY,"H. No. 8-2-144, Sham Sundar Nagar, Shah Gunj Bidar",Bidar,KARNATAKA,Not Available,9845789557,Not Available,divyadarshansocietybidar(at)gmail[dot]com
0,Divyajyothi Seva Trust (R),No.52 3rd Cross Sharadha Layout Pattanagere Rajarajeshwari Nagar Bangalore 560 098,Bangalore,KARNATAKA,Not Available,7899166677,http://www.djst.co.in,aveeshree91(at)gmail[dot]com
0,Divyajyothi Vidya Kendra,"DivyaJyothi Vidya Kendra Vishwa Kendra, Chikkanna Layout, Nelmangala Town -562123",Bangalore Rural,KARNATAKA,080-27726066,9886384609,http://www.djvk.org,presidentdjvk(at)gmail[dot]com
